title,description,year,type,rate_start,votes,status,followers,episodes,genders,url_anime,image
Vandread The Second Stage,"Aunque Hibiki y el resto de la tripulación derrotaron una nave de combate enorme de la Tierra al final de la primera parte, descubrieron que 5 naves se dirigían a Mejeiru y Tarahk. También descubrieron que en dichos planetas es donde sus hogares se vieron forzados a la tradición del Karitori (la cosecha). El viaje a casa se acelera para poder informar de la crisis. En el trayecto encuentran a una chica llamada Misty, la cual les enseña costumbres de la Tierra anteriores al desastre que desencadenó la cosecha, además de encapricharse con Hibiki; haciéndole a Dita la vida imposible. Cuando lleguen al final de su viaje deberán combinar sus vehículos una vez más y obtener un Vandread más poderoso aún si es que quieren salvar su planeta...",2001,Anime,4.7,107,Finalizado,480,13,"Acción,Ciencia Ficción,Ecchi,Espacial,Mecha,Shounen,",https://www3.animeflv.net/anime/vandread-the-second-stage,https://www3.animeflv.net/uploads/animes/covers/485.jpg
Mahoromatic,"Suguru, un despreocupado niño de 14 años es huérfano y vive solo en una mansión, por lo tanto su casa es un lo más parecido a un estercolero, por eso mismo decide contratar una asistenta para volver a vivir en en una pulcritd decente, ella será Mahoro, un antiguo androide de combate de Vesper, que por voluntad propia se hizo criada, ya que la propia empresa que le creo decidió darle voluntad a hacer lo que quiera porque tras 12 años de existencia si continuaba luchando tendría 50 días de vida, mientras que si se dedicaba a otra cosa tendría aproximadamente 1 año de vida. Junto a los amigos de Suguru, su profesora, Mahoro, Slash (guardian protector de Mahoro) tendrán peripecias de lo mas insólitas, hasta que aparezca un miembro de Saint buscando venganza...
",2001,Anime,4.6,85,Finalizado,972,12,"Ciencia Ficción,Comedia,Ecchi,Militar,Romance,",https://www3.animeflv.net/anime/mahoromatic,https://www3.animeflv.net/uploads/animes/covers/2058.jpg
X (2001),"Kamui una persona en la cual radica el futuro de la tierra, la decisión que tomé cambiará totalmente el destino, en él está salvar y que todo continúe de la forma en que está o bien, decidir la purificación a través de su destrucción. Estas dos posturas son defendidas por un dos grupos, Dragones de la Tierra y los Dragones del Cielo, quienes saben que deben seguir a Kamui. La batalla entre estos dos grupos, es por destruir cada uno de los puntos que hacen de Tokyo un gigante kekai, si todos los puntos de kekai son destruidos la Tierra lo será con ellos.
",2001,Anime,4.5,86,Finalizado,894,24,"Acción,Drama,Fantasía,Magia,Romance,Shoujo,Superpoderes,",https://www3.animeflv.net/anime/X-2001,https://www3.animeflv.net/uploads/animes/covers/1383.jpg
Chicchana Yukitsukai Sugar,"Saga, una chica joven, lleva una vida normal junto a su abuela en un pequeño pueblo. Un día encuentra una pequeña criatura de pelo rosa que parece estar enferma. Pensando que está hambrienta, Saga la alimenta y se la lleva a casa. La criatura resulta ser Sugar, una aprendiz de hada de las nieves, una hiperactiva y alegre hada con poderes mágicos y la habilidad de hacer que nieve... y ¡sólo puede ser vista por Saga! ¿Qué hará Saga con su planificada vida ahora que ha encontrado a este sorprendente ser?, y ¿conseguirá Sugar cumplir los objetivos por los cuales vino al mundo de los humanos?
",2001,Anime,4.8,19,Finalizado,132,24,"Comedia,Fantasía,Recuentos de la vida,",https://www3.animeflv.net/anime/chicchana-yukitsukai-sugar,https://www3.animeflv.net/uploads/animes/covers/1722.jpg
Cowboy Bebop: Tengoku no Tobira,"Marte, año 2071, poco antes del día de Halloween. Un camión cisterna lleno de productos químicos hace explosión en una de las calles más importantes de la ciudad, liberando un nuevo virus letal que acaba con la vida de cientos de personas.
Las autoridades, temiendo un nuevo ataque aún más destructivo, fijan una recompensa millonaria para quien capture a los responsables.
Mientras tanto, en la nave ""Bebop"", Spike y su banda de cazadores de recompensas están aburridos y sin dinero, hasta que conocen la noticia de la recompensa.",2001,Película,4.7,261,Finalizado,1596,1,"Acción,Ciencia Ficción,Drama,Espacial,Misterio,",https://www3.animeflv.net/anime/cowboy-bebop-tengoku-no-obira,https://www3.animeflv.net/uploads/animes/covers/2305.jpg
X OVA,,2001,OVA,4.1,25,Finalizado,242,1,"Drama,Fantasía,Misterio,Romance,Sobrenatural,",https://www3.animeflv.net/anime/x-ova,https://www3.animeflv.net/uploads/animes/covers/1385.jpg
Di Gi Charat Natsuyasumi Special,,2001,OVA,3.7,10,Finalizado,39,4,"Comedia,",https://www3.animeflv.net/anime/di-gi-charat-natsuyasumi-special,https://www3.animeflv.net/uploads/animes/covers/2012.jpg
Samurai Girl Real Bout High School,"Ryoko Mitsurugi es una estudiante que intenta convertirse en samurai. En su instituto, existe un sistema llamado “lucha K”. Es un sistema que resuelve todos los problemas mediante un duelo de reconocimiento oficial. Y Ryoko es la actual campeona de la lucha K. Ryoko es desafiada por una persona infalible, y tras la derrota, su vida escolar se vuelve más desastrosa cada día. Un día, Ryoko obtiene un misterioso pendiente. Y tras un brillo extraño del pendiente, se encuentra de repente en otro mundo. Allí encuentra un altar llamado Reiha, y el mundo se llama “Solvania Shadow”. Invoca a Ryoko, el ogro de Yenen, y le pide que derrote al monstruo de este mundo por ella.
",2001,Anime,3.1,24,Finalizado,193,13,"Aventuras,Comedia,Fantasía,Shounen,",https://www3.animeflv.net/anime/samurai-girl-real-bout-high-school,https://www3.animeflv.net/uploads/animes/covers/1924.jpg
Grappler Baki: Saidai Tournament Hen,"Baki Hamma es actualmente el campeón de las peleas underground, donde la única es regla es ""no utilizar armas, todo lo demás está permitido"". Solo los mejores y más selectos peleadores tienen la oportunidad de participar. Esta vez, quien gane el campeonato ganara el cinturón legendario que está valorado en 7 millones de dolares, si bien es un gran premio, lo que los peleadores realmente quieren es ganar para ser conocido como el hombre más fuerte del mundo. Sin olvidar que el propósito de Baki es, ser el más fuerte para derrotar a su padre (Yujiro Hamma) quien asesino a su madre frente a sus ojos. En el torneo hay peleadores de todos los estilos, lo cual hace que sea un campeonato muy interesante.",2001,Anime,4.5,316,Finalizado,3411,24,"Acción,Artes Marciales,Deportes,Shounen,",https://www3.animeflv.net/anime/grappler-baki-saidai-tournament-hen,https://www3.animeflv.net/uploads/animes/covers/1763.jpg
Sen to Chihiro no Kamikakushi,"Se trata de Chihiro, quien con sus padres se mudan a vivir a otra cuidad, aunque ella no esta de acuerdo con dicha decision. Al no encontrar el camino correcto a casa, se pierden en un bosque misterioso; llegan al final del camino y se encuentran de frente a un tunel. Al llegar al otro lado del tunel encuentran un pueblito deshabitado pero con muchos restaurantes, al no encontrarse nadie, sus padres deciden empezar a comer y pagar luego. Al ponerse el sol se convierten en cerdos. Ahora Chihiro tienen que hacer lo imposible para hacer que sus padres vuelven a la normalidad y asi llevarselos de vuelta a casa. Es la única película en la historia del anime que ganó un premio Oscar por animación
",2001,Película,4.7,1287,Finalizado,5018,1,"Aventuras,Drama,Sobrenatural,",https://www3.animeflv.net/anime/sen-to-chihiro-no-kamikakushi,https://www3.animeflv.net/uploads/animes/covers/1674.jpg
Happy☆Lesson,"¿A qué chaval no le gustaría pasar el día rodeado de un montón de mujeres guapas? Pues a Chitose. Acaba de salir del orfanato y ha regresado a casa de sus fallecidos padres. Pero en lugar de estar disfrutando de su vida de soltero y sin compromiso, tendrá que esquivar la educación de sus nuevas cinco madres. Sus profesoras le han adoptado, y si no fuera por ese fervor maternal casi enfermizo, podría decirse que están de muy buen ver. No te pierdas los 5 OVAS, capítulos especiales, donde la familia al completo disfrutará de unas estupendas vacaciones en un pequeño y tranquilo complejo turístico junto al mar. Después de esto, las vacaciones de Navidad no volverán a ser las mismas, si pasas estas locas y desternillantes Navidades con Chitose, Minazuki, Hazuki y sus cinco madres. Quizá piensas que ya lo has visto todo en un anime, pero todavía no has visto nada. Así que, asegúrate de que no te quedas sin asiento para vivir la primera experiencia de Happy Lesson.
",2001,OVA,4.3,29,Finalizado,289,5,"Comedia,Escolares,Harem,Romance,",https://www3.animeflv.net/anime/happy-lesson,https://www3.animeflv.net/uploads/animes/covers/1972.jpg
Motto! Ojamajo Doremi: Kaeru Ishi no Himitsu,,2001,Película,3.8,17,Finalizado,137,1,"Infantil,Magia,Shoujo,",https://www3.animeflv.net/anime/motto-ojamajo-doremi-kaeru-ishi-no-himitsu,https://www3.animeflv.net/uploads/animes/covers/2069.jpg
Seikai no Senki II,"La conquista de la galaxia ha comenzado y toda la flota del Imperio se ha lanzado en un operación para reclamar todos y cada unos de los mundos, de entre los mundos dominados destaca Lobnas II un planeta prisión que será administrado por Lafiel y Jinto los recién nombrados embajadores del imperio, ¿pero lograran cumplir con su misión?
",2001,Anime,4.5,23,Finalizado,75,10,"Acción,Ciencia Ficción,Espacial,Militar,Romance,",https://www3.animeflv.net/anime/seikai-no-senki-2,https://www3.animeflv.net/uploads/animes/covers/2054.jpg
Fruits Basket,"Honda Toru es una estudiante que después de la muerte de su madre decide vivir sola en una tienda de campaña en el bosque, propiedad de la familia Soma. Una noche es encontrada por Yuki Soma, el ""príncipe"" de su escuela, este y su primo Shigure le piden que viva con ellos.
Dentro de la casa conoce a Kyo, otro integrante de la familia Soma y la terrible maldición que pesa sobre ellos que consiste que al ser abrazados por el sexo opuesto se transforman en animales del zodiaco chino (a excepción de Kyo que es el gato).",2001,Anime,4.6,513,Finalizado,4186,26,"Comedia,Drama,Fantasía,Recuentos de la vida,Romance,Shoujo,",https://www3.animeflv.net/anime/fruits-basket,https://www3.animeflv.net/uploads/animes/covers/1392.jpg
Shaman King,"La historia empieza cuando Manta Oyamada, un estudiante de secundaria, que pasa por el cementerio local porque se le hace tarde, y divisa a un joven misterioso que simplemente observa las estrellas. Yoh Asakura le invita a quedarse con él y sus amigos a verlos, Manta huye asustado a ver que los amigos eran fantasmas. Manta le cuenta a sus ""amigos"" lo ocurrido y ellos no le creen. Después, Yoh decidió ser amigo de Manta, a pesar de que al principio Manta le tenia miedo a Yoh.",2001,Anime,4.5,747,Finalizado,4982,64,"Acción,Aventuras,Comedia,Drama,Shounen,Sobrenatural,",https://www3.animeflv.net/anime/shaman-king,https://www3.animeflv.net/uploads/animes/covers/84.jpg
s.CRY.ed,"En el futuro, un fenómeno inexplicable ha ocurrido en una distante isla llamada ""La tierra perdida"", dando lugar a una nueva especie de humanos. Estos humanos evolucionados, llamados usuarios de Alter, son capaces de manipular materia y reformarla en formas únicas. En esta isla remota, aquellos nacidos dentro de una ciudad amurallada son ciudadanos, mientras que los nacidos fuera viven sin leyes. En un intento de mantener la paz, la fuerza policial HOLD junto al grupo de elite de usuarios de Alter, HOLY, capturan a los peligrosos usuarios de Alter nativos y les ofrecen una opción... unirse a HOLY o ser aprisionados. Después del encuentro del joven usuario de Alter nativo, Kazuma, con HOLY, las dudas crecen: De verdad esta HOLY interesada en el bien común, o hay alguna otra razón detrás de sus acciones ",2001,Anime,4.3,65,Finalizado,271,26,"Acción,Aventuras,Ciencia Ficción,Drama,Superpoderes,",https://www3.animeflv.net/anime/s-cry-ed,https://www3.animeflv.net/uploads/animes/covers/525.jpg
Steel Angel Kurumi Zero,"En el lejano futuro, Kurumi, Saki y Karinka comparten un departamento con otra chica, Excelia. Un día, después de la escuela, Kurumi le dice a todas que ella está enamorada de un hombre que acaba de conocer, Michihito Kagura, el problema es que no sabe cuando lo volvera a ver.
",2001,OVA,4.7,12,Finalizado,150,3,"Ciencia Ficción,Drama,Romance,",https://www3.animeflv.net/anime/steel-angel-kurumi-zero,https://www3.animeflv.net/uploads/animes/covers/1998.jpg
Steel Angel Kurumi Shiki,Toma lugar 75 años después de la primera temporada.,2001,Anime,3.9,38,Finalizado,195,12,"Ciencia Ficción,Comedia,Mecha,Romance,Shounen,Yuri,",https://www3.animeflv.net/anime/steel-angel-kurumi-shiki,https://www3.animeflv.net/uploads/animes/covers/1336.jpg
Hanaukyo Maid Tai,Esta Historia nos habla de un niño de 15 años llamado Hanaukyo que tras la muerte de su madre se va a visitar a su abuelo. Lo que él no sabia era que el abuelo era absurdamente rico y dejo a su cargo una inmensa mansión y docenas de sirvientas que estarán dispuesta a todo con tal de complacerlo.,2001,Anime,4.4,124,Finalizado,2066,15,"Comedia,Ecchi,Harem,Romance,",https://www3.animeflv.net/anime/hanaukyo-maid-tai,https://www3.animeflv.net/uploads/animes/covers/530.jpg
Galaxy Angel,"La División de los Ángeles es una de las múltiples secciones del ejército. Sus miembros son los encargados de llevar a cabo las misiones que les son encomendadas. Podría parecer un trabajo normal, pero las misiones que se les ordenan no son nada habituales.
Desde capturar gatos, hasta recoger basura interplanetaria, a nuestras protagonistas se les encarga cualquier tipo de tarea. Si a esto le añades la peculiar forma de ser de cada una de nuestras protagonistas: Milfeulle (la chica inocente que goza de una suerte increíble), Ranpha (obsesionada con encontrar un novio), Forte (una fanática de las armas), Mint (la más calculadora, pero también con su pequeña obsesión), Vanilla (tímida y reservada) y Nomat (un chip de un misil, que en más de una ocasión sacará de sus casillas al resto de compañeros de la División); la risa está asegurada.
",2001,Anime,4.5,21,Finalizado,169,26,"Ciencia Ficción,Comedia,",https://www3.animeflv.net/anime/galaxy-angel,https://www3.animeflv.net/uploads/animes/covers/2163.jpg
Project ARMS,"Un chico se ve implicado en un accidente cuando iba a la guardería, dañando horriblemente su brazo, pero los médicos se las arreglan para salvarselo. Ahora, varios años después, su brazo parece haberse convertido en el foco de unos extraños sucesos que hacen que organizaciones secretas intenten capturarle para hacerse con el poder que posee.
",2001,Anime,4.1,47,Finalizado,228,26,"Acción,Artes Marciales,Superpoderes,",https://www3.animeflv.net/anime/project-arms,https://www3.animeflv.net/uploads/animes/covers/2349.jpg
Noir,"Mireille Boquet (asesina a sueldo) recibe el mail de una misteriosa chica pidiéndole ayuda. La misma no recuerda nada de su pasado, es perseguida por unos ""mafiosos"", es excelente asesina, y la única pertenencia que tiene es un reloj, cuya melodía le es muy familiar a Mireille. Trabajaran a duo e intentarán descubrir el misterioso pasado de Kirika, con una condición: Una vez descubierta la verdad, Mireille matará a Kirika.",2001,Anime,4.6,66,Finalizado,609,26,"Acción,Drama,Misterio,",https://www3.animeflv.net/anime/noir,https://www3.animeflv.net/uploads/animes/covers/555.jpg
Geneshaft,"En el siglo vigésimo tercero, los humanos sobrevivieron a una aniquilación total en el siglo XXI. Sin embargo, su existencia es amenazada por la aparición en el espacio de una extraña estructura con forma de anillo. Una tripulación es reunida a bordo de una nueva poderosa nave de guerra, el Birkis, equipado con un ""mecha"" igualmente de extraño y poderoso llamado ""Shaft"". Su objetivo es la destrucción de los Anillos. En este nuevo mundo, el gobierno controla el ADN (el tipo de Gen) de la gente. Los bebés están hechos a medida de las necesidades de gobierno, y no nacen de la mujer, sino genéticamente en laboratorios. El ADN decide el futuro de cada persona, la caul solo vive hasta los cuarenta años. Mika Seido tiene un gen tipo ""blanco"" lo que significa que no tiene ninguna habilidad en especial, por eso la consideran como anormal. Ella junto a una tripulación de mujeres y un hombre como capitán intentaran destruir el misterioso anillo.",2001,Anime,3.5,23,Finalizado,104,13,"Aventuras,Ciencia Ficción,Espacial,Mecha,",https://www3.animeflv.net/anime/geneshaft,https://www3.animeflv.net/uploads/animes/covers/291.jpg
Sister Princess,"Sister princess es una serie que toma como personaje principal a un chico el cual se ve obligado a continuar sus estudios en una isla en la cual se toma con una gran sospresa que tiene 13 HERMANAS.. las cuales son un poco peculiares cada una tiene un actitud diferente,nuestro perzonaje se vera ante situaciones algo comunes y poco comunes en la vida real sin duda este anime contiene el tema de la tolerancia y reflexion entre otros.
",2001,Anime,4.7,53,Finalizado,506,26,"Comedia,Drama,Harem,Recuentos de la vida,Romance,",https://www3.animeflv.net/anime/sister-princess,https://www3.animeflv.net/uploads/animes/covers/601.jpg
The SoulTaker: Tamashii-gari,"Tras ser apuñalado en el pecho por su madre moribunda, Kyosuke Date regresa de la muerte y descubre que tiene una hermana gemela llamada Runa y la habilidad de convertirse en un poderoso mutante conocido como SoulTaker. Mientras viaja en busca de su hermana va encontrándose con las Furikas (del inglés flicker, destello), chicas que resultan ser fragmentos del alma de su propia hermana y que son buscadas por las máquinas de la Corporación Kirihara (para intentar localizar a la verdadera Runa con tal de lograr un oscuro propósito) y por los médicos y enfermeras mutantes de Hospital (quienes desean simplemente exterminar a las Furikas y a la propia Runa) Kyosuke deberá luchar contra ambas organizaciones a lo largo de su viaje y descubrir que se proponen en realidad, y para ello recibirá la ayuda del misterioso Shiro Mibu y de la enfermera Komugi Nakahara.",2001,Anime,4.4,37,Finalizado,476,13,"Demonios,Sobrenatural,Terror,",https://www3.animeflv.net/anime/the-soultaker-tamashii-gari,https://www3.animeflv.net/uploads/animes/covers/2392.jpg
Pretear,"Himeno Awayuki, una estudiante de secundaria, está tratando de adaptarse a su nueva vida después de que su padre viudo se casa con Natsue, una mujer rica tremendamente rica. Un buen día, mientras coge un atajo para no llegar tarde a clase, se tropieza con Hayate, el Caballero del Viento, quién descubre que Himeno es el Prétear. Más tarde, los Leafe Knights se aparecen ante Himeno para pedirle que se transforme en el Prétear y les ayude a proteger el Leafe, la esencia de todo organismo viviente. Le explican que la nieve roja que está cayendo es una señal del inminente despertar de la Princesa del Desastre, quién está tratando de absorber todo el Leafe, y que no pueden derrotarla sin su ayuda. Aunque al principio piensa que le están tratando de gastar una broma, finalmente opta por hacer el intento y se convierte en el Prétear. Y con esto, comienzan las aventuras de Himeno para proteger la energía que hace posible la vida y salvar el mundo. ",2001,Anime,4.6,116,Finalizado,941,13,"Comedia,Drama,Fantasía,Magia,Romance,Shoujo,Superpoderes,",https://www3.animeflv.net/anime/pretear,https://www3.animeflv.net/uploads/animes/covers/607.jpg
Mahou Senshi Louie,"El hechicero Louie, aún lejos de ser un auténtico hechicero, no hace más que pensar en una vida repleta de aventuras. Un día se encuentra con un grupo de jóvenes aventureras: la sacerdotisa Melissa, la ladrona Mirelle y la espadachina Geenie. Louie intenta hacerse compañero de ellas y unírseles en sus aventuras, pero enseguida es rechazado. Louie, quien nunca se rinde, va al santuario de Melissa a intentar persuadirla. Allí, Melissa tiene lo que interpreta como una revelación de su dios: que Louie es el héroe al que ella debe servir. Con esto, las tres muchachas tendrán que aceptar a Louie en su grupo...
",2001,Anime,4.4,48,Finalizado,258,24,"Aventuras,Comedia,Fantasía,Magia,Shounen,",https://www3.animeflv.net/anime/mahou-senshi-louie,https://www3.animeflv.net/uploads/animes/covers/2142.jpg
Comic Party,"La adaptación del anime Comic Party primera vez en Japón el 1 de abril de 2001, relativa a las estaciones UHF. Trece episodios de diez minutos y cuatro especiales fueron producidos por la luz y la magia oriental y KSS y dirigida por Norihiko Sudo. El anime se centra en la creación d?jinshi parte del juego más que el aspecto de citas y los especiales son una historia original la participación del elenco de Comic Parte teniendo unas vacaciones a un balneario.",2001,Anime,4.6,17,Finalizado,165,13,"Comedia,Drama,",https://www3.animeflv.net/anime/comic-party,https://www3.animeflv.net/uploads/animes/covers/1741.jpg
Super GALS! Kotobuki Ran,"Kotobuki es una chica de 16 años que estudia en el instituto Hounan, pero no es una joven más, ella se ha convertido en la más importante de las ko-gals de Shibuya. Siempre va a la última moda, es moderna e independiente; y no teme a nada ni a nadie. Ran proviene de una familia en la que todos sus miembros son policías, desde su hermano mayor Yamato, hasta su madre y su padre, el jefe de inspectores Taizo Kotobuki. Y todos la presionan para que ella siga los pasos del resto de la familia. Pero ella no está dispuesta a trabajar en algo tan aburrido y que no le atrae en absoluto. Además eso no le permitiría ir a la moda, su auténtica obsesión. En el instituto las mejores amigas de Ran son Miyu Yamazaki, que comparte sus aficiones, aunque es una chica mucho más calmada y tranquila, y Aya Hoshino, una chica reservada que oculta un secreto que pronto será desvelado.
",2001,Anime,4.5,51,Finalizado,359,52,"Comedia,Recuentos de la vida,Shoujo,",https://www3.animeflv.net/anime/super-gals-kotobuki-ran,https://www3.animeflv.net/uploads/animes/covers/2029.jpg
Angelic Layer,"La historia se centra en Misaki Suzuhara que, al llegar a Tokio, donde va a vivir de ahora en adelante, aprende lo que son ""ángeles"", muñecas de pequeño tamaño, comprables en las tiendas, y cuyo juego de lucha es de los más populares allí. Con la ayuda del misterioso Itchan, Misaki se inicia en el mundo de las luchas de ángeles, haciendo amistades y descubrimientos en el terreno de batalla que lograrán que lo vea como algo más que un simple juego.",2001,Anime,4.4,59,Finalizado,552,26,"Ciencia Ficción,Comedia,Deportes,Drama,Shounen,",https://www3.animeflv.net/anime/angelic-layer,https://www3.animeflv.net/uploads/animes/covers/199.jpg
Digimon Tamers,"Digimon Adventure y Adventure 02 han sido para muchos niños una gran serie de anime, incluso se ha sacado un juego muy popular de cartas en Japón, uno de esos niños es Takato Matsuda, el cual sueña con tener su propio Digimon. Un día, mientras Takato juega con cartas, se encuentra con una carta azul muy extraña que jamas había visto antes, carta que luego transforma su digi-device y le permite crear su propio Digimon, junto con amigos comenzaran increíbles aventuras tanto en el mundo real como en el Digimundo.",2001,Anime,4.6,339,Finalizado,2128,51,"Aventuras,Comedia,Drama,Fantasía,Shounen,",https://www3.animeflv.net/anime/digimon-tamers,https://www3.animeflv.net/uploads/animes/covers/947.jpg
Puni Puni Poemi,"Poemi Watanabe (llamada a sí misma Kobayashi), es una niña de 10 años com aspiraciones de volverse una famosa seiyuu. Desafortunadamente, sus notas no son buenas y su voz todavía peor. Pero cuando un alien misterioso mata a sus padres y comienza a destruir tokyo, Poemi agarra un pez parlante, lo atraviesa con un cuchillo y se convierte en la casi heroína Puni Puni Poemi para salvar el día. La serie es una continuación alterna de Excel Saga (prácticamente el episodio 26).",2001,OVA,3.4,21,Finalizado,169,2,"Ciencia Ficción,Comedia,Magia,Shounen,",https://www3.animeflv.net/anime/puni-puni-poemi,https://www3.animeflv.net/uploads/animes/covers/1532.jpg
Motto! Ojamajo Doremi,Tercera temporada de Ojamajo Doremi.,2001,Anime,4.4,39,Finalizado,347,50,"Comedia,Fantasía,Magia,Shoujo,",https://www3.animeflv.net/anime/motto-ojamajo-doremi,https://www3.animeflv.net/uploads/animes/covers/2066.jpg
Initial D: Third Stage,"Apenas antes de graduarse de la secundaria, Takumi es sondeado por el líder de los Redsuns Ryosuke Takahashi, quien le ofrece unirse a su nuevo equipo para recorrer el país en busca de victorias y récords. Antes de decidirse, Takumi volverá a verse las caras con el líder de los Emperors Kyouichi y tendrá un nuevo reto..con el hijo del archirival del padre de Takumi, Bunta...",2001,Anime,4.6,193,Finalizado,1080,2,"Acción,Carreras,Deportes,Drama,Seinen,",https://www3.animeflv.net/anime/initial-d-3,https://www3.animeflv.net/uploads/animes/covers/979.jpg
Grappler Baki,"Baki Hanma, es un luchador joven que se muere de ganas por seguir los pasos de su padre, Yujiro Hanma, y convertirse en el luchador más fuerte del mundo. A través de esto, él se entrena incansablemente y lucha constantemente para afilar sus habilidades y desarrollar su cuerpo para alcanzar estos objetivos. Muchas batallas intensas le deparan a Baki; como él va buscando ser el mejor para, en última instancia, tomar el título de ""Rey"" de su padre; Baki Hanma, hijo del grappler más fuerte del mundo, trata de reclamar el trono de su padre. Para conseguirlo, él tiene que luchar mucho, y hacer muchos amigos y enemigos en el proceso.",2001,Anime,4.3,656,Finalizado,6308,24,"Deportes,Shounen,",https://www3.animeflv.net/anime/drappler-baki,https://www3.animeflv.net/uploads/animes/covers/1762.jpg
