title,description,year,type,rate_start,votes,status,followers,episodes,genders,url_anime,image
Mermaid Forest,"Yuta es un joven que después de comer carne de sirena, se volvió un inmortal y a pasado 500 años buscando u otro inmortal como él, ya que cuando se come la carne de sirena puede ser que se convierta en un monstruo denominado ?alma perdida?, y ahora por fin en una isla a encontrado otro inmortal una joven llamada Mana a la cual salvo de ser el alimento de una tribu de sirenas, Mana nunca salió de ese poblado de sirenas pero ahora en compañía de Yuta comenzaran un viaje para buscar una cura y volver a ser normales, en este viaje se encontraran con diversas personas que de un modo u otro se relacionan con las sirenas y su poder para dar la inmortalidad, pero también se encontraran con almas perdidas que pretenden recuperar su humanidad, también a lo largo de este viaje Mana conocerá el pasado de Yuta y así juntos buscaran su lugar en el mundo?
",2003,Anime,4.6,46,Finalizado,357,13,"Drama,Fantasía,Misterio,Terror,",https://www3.animeflv.net/anime/mermaid-forest,https://www3.animeflv.net/uploads/animes/covers/406.jpg
Kimi ga Nozomu Eien,"Narumi Takayuki es un estudiante de tercer curso que no ha estudiado demasiado para los exámenes de acceso al instituto. Sin embargo, estos días no está aprovechando para estudiar ni es capaz de encontrar tampoco nada que le apetezca hacer.
Sus amigos, Taira Shinji y Hayase Mizuki, están estudiando mucho y haciendo algo de natación, así que Takayuki se siente un extraño.
Hasta que un día conoce a una chica...
",2003,Anime,4.6,183,Finalizado,1582,14,"Drama,Recuentos de la vida,Romance,",https://www3.animeflv.net/anime/kimi-ga-nozomu-eien,https://www3.animeflv.net/uploads/animes/covers/1709.jpg
Fullmetal Alchemist,"Tras perder a su madre, Alphonse y Edward Elric tratan de revivirla usando la ciencia prohibida de la alquimia humana. Sin embargo, la alquimia opera bajo la teoría del cambio equivalente y romper el tabú de la alquimia humana acarrea un alto precio. Ed pierde una de sus piernas y Al su cuerpo. Ed logra sellar el alma de Al dentro de una gran armadura, a costa de su brazo. Años después, Ed (ahora con dos extremidades mecánicas) y Al (aún atrapado en la armadura) dejan su casa de la niñez, cada uno preocupado por la felicidad del otro. Ed, quien tuvo un talento y habilidad natural para la alquimia, se convierte en un alquimista con certificado nacional y pronto es conocido en todas partes como el ?Alquimista Fullmetal?. El verdadero objetivo de ambos hermanos es buscar cualquier información sobre la legendaria Piedra Filosofal, con la esperanza de que ésta les permita recobrar sus cuerpos. Todas sus esperanzas descansan en la mítica piedra, que incluso puede no existir.",2003,Anime,4.6,1591,Finalizado,17278,51,"Acción,Aventuras,Comedia,Drama,Fantasía,Magia,Militar,Shounen,",https://www3.animeflv.net/anime/fullmetal-alchemist,https://www3.animeflv.net/uploads/animes/covers/40.jpg
Kousetsu Hyaku Monogatari,"La historia transcurre en la Era Bakumatsu, cuando los cimientos del gobierno de Tokugawa empezaron a tambalearse.
En la edad donde la ""Oscuridad"" se respiraba y la presencia de monstruos era muy temida, un escritor soñador, Yamaoka Hyakusuke, viaja por todos los países con la esperanza de publicar en todo el mundo su obra ""Hyaku Monogatari"".
En el camino, se encontrará con criminales como Mataichi del Sufrimiento, Ogin de los Muñecos o Chouji de la LLamada de los Pájaros. Son una banda criminal secreta, contratada para resolver casos que son enterrados en la oscuridad.
Buscando al criminal, usando hábiles estratagemas, juzgarán el ego humano y cerrarán un caso tras otro, siempre acompañados por un sonido de campanas y la palabra ""Go Koui Tatemasaru"" (que significa ""yo lo haré"", en un japonés antiguo y refinado)",2003,Anime,4.6,36,Finalizado,473,13,"Fantasía,Historico,Misterio,Psicológico,Sobrenatural,Terror,",https://www3.animeflv.net/anime/kousetsu-hyaku-monogatari,https://www3.animeflv.net/uploads/animes/covers/1484.jpg
UFO Princess Valkyrie 2: Juunigatsu no Yasoukyoku,"Continuación de la primera temporada de Enban Oujo Warukyure (UFO Princess).
La historia gira en torno a Warukyure, la princesa de Valhalla, y Valhalla, un humano normal, y sus amigos.",2003,Anime,4.5,26,Finalizado,242,12,"Ciencia Ficción,Comedia,Romance,",https://www3.animeflv.net/anime/ufo-princess-valkyrie-2,https://www3.animeflv.net/uploads/animes/covers/1849.jpg
Planetes,"En el año 2075 la humanidad ha alcanzado un punto donde viajar entre la Tierra, la Luna y las estaciones espaciales en parte de la vida diaria. Sin embargo, el progreso de la tecnología en el espacio ha resultado también un problema con los residuos espaciales, que pueden causar grandes daños a las naves y a los equipos. Esta es la historia de la Sección de Recogida de Residuos de Technora, su especialista en trabajos EVA (Extra Vehicular Activity), Hachirota “Hachimaki” Hocino, y la recién llegada al grupo, Ai Tanabe.",2003,Anime,4.5,138,Finalizado,836,26,"Ciencia Ficción,Drama,Espacial,Romance,Seinen,",https://www3.animeflv.net/anime/planetes,https://www3.animeflv.net/uploads/animes/covers/2408.jpg
Sakigake!! Cromartie Koukou,"El honesto y leal Kamiyama ha ido a parar al conflictivo Instituto Cromartie, donde todo el mundo es un delincuente. Como es de esperar, pasará a ser el jefe de su clase, debido a la lógica invertida de que sólo un conejito realmente duro se atrevería tranquilamente a estar entre una manada de leones. Así empieza una historia que parodia cada uno de los tópicos del anime de ""tipos duros"" hasta límites insospechados. Ah, y Freddie Mercury también sale.
",2003,Anime,4.4,53,Finalizado,399,26,"Comedia,Escolares,Shounen,",https://www3.animeflv.net/anime/sakigake-cromartie-koukou,https://www3.animeflv.net/uploads/animes/covers/2345.jpg
Avenger,"La historia se encuentra en un colonizado Marte, en algún punto indeterminado en el futuro. La mayoría de la población humana se divide en un número pequeño de abombado ciudad-estado. Los que viven fuera de las cúpulas (domos) en los duros páramos del planeta que se conoce como Barbaroi. Los recursos son escasos, y los suministros se dividen entre ciudades sobre la base del resultado de las batallas entre gladiadores representante de cada uno de los combatientes. Agregando a los problemas de los colonos, los niños no han nacido en Marte durante una década. La causa de la inferitilidad se desconoce, pero las personas han recurrido a robots llamados ""Dolls"" (Muñecas) como un sustituto de la presencia de los niños en sus vidas. Y una luna roja, la luna de la Tierra, se cierne sobre Marte, señala hacia el planeta rojo después de la destrucción de la Tierra y estragos con tormentas lunares causados por fluctuaciones gravitacionales entre Marte y su satélite no deseadas.",2003,Anime,4.1,28,Finalizado,196,13,"Aventuras,Ciencia Ficción,Fantasía,Shounen,",https://www3.animeflv.net/anime/avenger,https://www3.animeflv.net/uploads/animes/covers/519.jpg
Yami to Boushi to Hon no Tabibito,"Hadsuki Azuma es una adolescente muy popular entre las chicas de su colegio, aunque ella sólo quiere a su hermana adoptiva Hatsumi, quien es muda. La noche que Hatsumi cumplía 16 años, Hadsuki entró a su cuarto, pero al intentar besar a su hermana quien estaba dormida, una luz verde invade la habitación y Hatsumi desaparece después de decir el nombre de su hermana. Minutos después un ave (Ken-chan) entró buscando a “Eve”. Hadsuki obligó al ave a llevarla con él, llegando a una enorme biblioteca. Allí se encuentran con Lilith, la hermana menor de Eve quien está a cargo de la biblioteca en ausencia de Eve y quien queda prendida de Hadzuki ya que le recuerda a Yamiyama o Papa. Ésta extraña biblioteca contiene todos loa mundos que existen. Lilith dice que Hatsumi es en realidad una de las formas de Eve y que cada 16 años Eve debe abandonar un libro e ir al próximo. así inicia la búsqueda de Hadzuki por su hermana a quien quiere declarale su amor.",2003,Anime,4.3,108,Finalizado,1467,13,"Aventuras,Ecchi,Fantasía,Magia,Misterio,Yuri,",https://www3.animeflv.net/anime/yami-to-boushi,https://www3.animeflv.net/uploads/animes/covers/178.jpg
Shinkon Gattai Godannar!!,"En el año 2042 hubo una gran batalla entre numerosos Super Robots y unas enormes criaturas sin identificar llamadas ""Bestias Miméticas"".
En la batalla final entre el Super Robot japonés Godanner y el último jefe de las Bestias Miméticas, el piloto, Saruwatari Goh pierde a Mira Ackerman, quien era su compañera de combate y amante. Pero a cambio, Goh rescata a una niña pequeña. Esa niña, de sólo doce años, es Aoi Anna.
Cinco años más tarde, Goh se retira del frente de combate, y para olvidar la tragedia de Mira, decide casarse con Anna, que por entonces había recibido experto entrenamiento para pilotar un Robot. Los dos estaban enamorados.
Sin embargo, en el día de la boda, reciben una llamada de emergencia. Goh se va de la boda a toda prisa, y Anna se queda conmocionada en su vestido de novia. Sin embargo, ella no es el tipo de chica que se queda a esperar a que vuelva su marido...
¿Podrán casarse algún día? ¿Y cuál será el destino de la Tierra?",2003,Anime,4.5,21,Finalizado,297,13,"Ciencia Ficción,Comedia,Ecchi,Mecha,Romance,",https://www3.animeflv.net/anime/shinkon-gattai-godannar,https://www3.animeflv.net/uploads/animes/covers/2400.jpg
Full Metal Panic! Fumoffu,"En Fumoffu veremos de nuevo las andanzas de S&#333;suke y Chidori pero con un tono cómico más marcado. La historia se desarrolla sin los AS ya que toda la trama se encuentra fuera de los campos de batalla de Mithril. En su lugar la historia se desarrolla en la escuela y lugares aledaños, además de que observaremos a S&#333;suke utilizando el disfraz del muñeco Bonta-kun, que es el apelativo común en Japón para los osos de peluche, con el que realizara varias aventuras y meterse en todo tipo de problemas con sus intentos fallidos para adaptarse a la vida común y corriente de Japón.",2003,Anime,4.6,314,Finalizado,2797,12,"Acción,Comedia,Escolares,",https://www3.animeflv.net/anime/full-metal-panic-fumoffu,https://www3.animeflv.net/uploads/animes/covers/417.jpg
Mahoromatic Summer Special,"Estamos en otro día ordinario en la residencia Misato, cuando de pronto Mahoro encuentra otra revista pornográfica en la habitación de Suguru. Esto hace que ella y Minawa hagan un pacto con Chizuko, Rin, Miyuki y Miss Shikijo para confiscar todo lo que sea pervertido de la casa. Ante esta situación, Suguru, Kiyomi y Toshiya harán todo lo que esté en su mano para proteger sus tesoros de las chicas.",2003,OVA,4.6,20,Finalizado,187,1,"Ciencia Ficción,Comedia,Ecchi,Romance,",https://www3.animeflv.net/anime/mahoromatic-summer-special,https://www3.animeflv.net/uploads/animes/covers/2060.jpg
RahXephon Kansoukyoku: Kanojo to Kanojo Jishin to - Thatness and Thereness ,"Este episodio muestra el diálogo de Quon Kisaragi con su otra yo como series de secuencias de sueños. Hacia el final del episodio, Quon recuerda algo crucial de su pasado y decide algo para el futuro.",2003,OVA,3.3,13,Finalizado,67,1,"Ciencia Ficción,Drama,Psicológico,",https://www3.animeflv.net/anime/rahxephon-ova,https://www3.animeflv.net/uploads/animes/covers/1456.jpg
Ikkitousen,"Los espíritus de los héroes legendarios que lucharon por la unificación de China en la era de los tres reinos se encuentran sellados dentro de antiquísimas gemas y esparcidos por todo Japón. Estas gemas conocidas como ""magatamas"", tienen la capacidad de despertar el enorme poder dormido que hay en las reencarnaciones de los antiguos héroes chinos, hombres y mujeres con apetito insaciable de combate y que se llaman a sí mismos ""guerreros"". La hermosa Hakufu Sonsaku es una de estos guerreros, y ha vivido toda su vida aislada en las afueras de la ciudad, entrenando con su madre y reprimiendo su deseo de pelear. Pero ha llegado el día en que Hakufu debe abandonar su hogar, mudarse a Tokyo para comenzar a estudiar en un instituto repleto de guerreros, y así cumplir su destino inmortal...",2003,Anime,4.5,215,Finalizado,5213,13,"Artes Marciales,Ecchi,Escolares,Superpoderes,",https://www3.animeflv.net/anime/ikkitousen,https://www3.animeflv.net/uploads/animes/covers/50.jpg
Shin Hokuto no Ken,"Una banda de matones liderados por el cruel Sanga han creado una zona fortificada, llamada Lastland, donde han tomado el control de lo último que queda de civilización. Evidentemente, también se han apoderado del agua. Pero además, dado que la codicia de Sanga no conoce límites, se ha atrevido a secuestrar a Sarah, una mujer que cura las heridas de la gente con las yemas de los dedos, y a Doha, un hombre que genera agua usando sus puños, para convertirse, así, en un auto-proclamado dios. En otras tierras, un grupo de aldeanos ha encontrado otra fuente de agua potable, y desde que el sanguinario Sanga lo ha sabido, se han convertido en sus últimas víctimas.
",2003,OVA,4.6,25,Finalizado,145,3,"Acción,Artes Marciales,Ciencia Ficción,Shounen,",https://www3.animeflv.net/anime/shin-hokuto-no-ken,https://www3.animeflv.net/uploads/animes/covers/1519.jpg
Onegai Twins!,"Esta historia trata sobre tres jóvenes huérfanos lo cuales viven vidas totalmente diferentes y distantes, ellos al ver las noticias por casualidad se enteran de que el lugar donde se transmite esa información es la casa donde vivieron alguna vez cuando eran bebes; pueden saber esto ya que cada uno contiene una foto de su infancia. Kamishiro Mike, Miyafuji Mina y Onoreda Karen se dirigen hacia esa casa pero se encuentran con una sorpresa ya que en la foto solo hay dos bebés y ellos son tres. Quién de ellos está equivocado y no estaba en la foto cuando fué tomada. En lo que lo averiguan los tres tratarán de vivir en la casa de sus recuerdos intentando ser una familia pero jaja dos chicas y un chico viviendo solos en una casa....muchas cosas sucederán.",2003,Anime,4.6,121,Finalizado,1297,13,"Ciencia Ficción,Comedia,Drama,Escolares,Harem,",https://www3.animeflv.net/anime/onegai-twins,https://www3.animeflv.net/uploads/animes/covers/319.jpg
Green Green,"En la escuela """"Kanenone Gakuen"""" solo estudian chicos donde acogen a un grupo de chicas provenientes de otro instituto durante el verano, a modo de prueba para ver si """"Kanenone"""" puede volverse más adelante una escuela mixta. Sin embargo, los chicos de la misma lo ven únicamente como una oportunidad para tener relaciones sexuales. En cuanto llegan las chicas a la escuela y se abren las puertas del autobús en el que venían, aparece de la nada una chica llamada Midori, quien al ver a Yuusuke se lanza sobre él. ",2003,Anime,4.3,131,Finalizado,964,14,"Comedia,Ecchi,Escolares,Recuentos de la vida,Romance,",https://www3.animeflv.net/anime/green-green,https://www3.animeflv.net/uploads/animes/covers/495.jpg
Rumiko Takahashi Anthology,"Antología de Rumiko Takahashi
El teatro de Rumiko consiste en 13 capítulos independientes basados en historias cortas de entre 1987 y 2000 de Rumiko Takahashi.",2003,Anime,4.4,17,Finalizado,128,13,"Comedia,Drama,Recuentos de la vida,Romance,Shounen,Sobrenatural,",https://www3.animeflv.net/anime/rumiko-takahashi-anthology,https://www3.animeflv.net/uploads/animes/covers/2146.jpg
El Teatro De Rumiko,"El Teatro de Rumiko consta de una serie de historias cortas de Rumiko Takahashi de los años 80 adaptadas a formato anime . La mayoría de ellas son semejantes a su trabajo en Maison Ikkoku, en la cual hay historias domésticas que únicamente giran en torno a sí mismas. ",2003,Anime,3.8,10,Finalizado,117,13,"Comedia,Drama,Recuentos de la vida,Romance,Shounen,Sobrenatural,",https://www3.animeflv.net/anime/el-teatro-de-rumiko,https://www3.animeflv.net/uploads/animes/covers/562.jpg
Da Capo,"El protagonista de la historia, Jun'Ichi Asakura, que va a la Academia Kazami, tiene el poder de ver los sueños de los demás cuando duerme. Además, aprendió la magia que le enseñó su abuela, que le permite crear dulces. Un día, Jun'Ichi parece haber visto los sueños de otra persona cuando dormía. En ese sueño, una niña de su propia infancia apareció. Pero su hermana Nemu lo despierta, haciéndolo volver de golpe a la realidad. Aunque no son realmente hermanos (ella es adoptada) tienen una vínculo muy fuerte, tanto que a veces da la impresión de que fueran amantes.",2003,Anime,4.3,90,Finalizado,1575,26,"Drama,Harem,Magia,Romance,",https://www3.animeflv.net/anime/da-capo,https://www3.animeflv.net/uploads/animes/covers/1500.jpg
Happy☆Lesson: Advance,"Si el pobre Chitose ya vivía estresado con tanta profesora loca suelta por su casa, ahora se le va a ir literalmente la olla. Llega al instituto Koyomi una nueva alumna que ataca a nuestro protagonista sin previo aviso. ¿Quién será? Disfruta de trece desternillantes episodios llenos de personajes alocados y entrañables.
",2003,Anime,4.7,42,Finalizado,377,13,"Comedia,Harem,Recuentos de la vida,Romance,",https://www3.animeflv.net/anime/happy-lesson-advance,https://www3.animeflv.net/uploads/animes/covers/1974.jpg
Eiken,"La escuela privada Zasshono, con un total de 54000 estudiantes de todos los niveles preuniversitarios, desde los mas elementales hasta el bachillerato superior, es un colosal centro de enseñanza. Dispone de una gran variedad de actividades culturales organizadas por sus clubs, pero entre todos estos grupos hay uno cuyas actividades estan envueltas por un halo de misterio, el Club Eiken, lo que provoca que sea mirado con suspicacia. Sin embargo, lo mas destacable de dicho Club son sus miembros, pues esta formado por las chicas mas guapas y carismaticas, como por ejemplo Azumo Chirau, que sobresale tanto en los deportes como en la vida academica. Mifune Densuke, es un nuevo estudiante de secundaria superior, que se ve obligado a formar parte de dicho Club. En el momento en que el es miembro del Eiken, su vida da un gran cambio llenandole de pasion, romance y problemas.",2003,OVA,4.0,42,Finalizado,349,1,"Comedia,Ecchi,Escolares,Harem,",https://www3.animeflv.net/anime/eiken,https://www3.animeflv.net/uploads/animes/covers/480.jpg
Cinderella Boy,"Ranma y Rella abrieron una agencia de detectives R&R en Kirin (jirafa) Town, la capital mundial del crimen. Durante una investigación, fueron atacados y se les dio por muertos en un accidente. Pero sobrevivieron. Sus cuerpos se volvieron extraños. Cuando el reloj da la medianoche, el cuerpo de Ranma desaparece para transformarse en el de Rella. Los dos aparecen unidos en un solo cuerpo. ¿Qué sucederá con los cuerpos de Ranma y de Rella? Una misteriosa mujer, Alice, aparece ante Ranma. ¿Cuál es su objetivo? Se levanta el telón para una chispeante comedia de acción.",2003,Anime,4.0,36,Finalizado,377,13,"Acción,Aventuras,Comedia,Misterio,Seinen,",https://www3.animeflv.net/anime/cinderella-boy,https://www3.animeflv.net/uploads/animes/covers/25.jpg
Hitsuji no uta,"La madre de Koujou Kazuna murió cuando era pequeño y él ha vivido con los amigos de su padre, el matrimonio Eda, desde entonces. Un día, cuando hacía de modelo en la academia de dibujo Yaegashi, Issa se desmayó y algo lo llevó de vuelta a casa. Allí, se encontró de nuevo con su hermana mayor y le habló sobre la ""enfermedad"" que azotaba a la familia Koujou.
Esa misteriosa enfermedad era el deseo por la sangre de otras personas. Kazuna también está afectado por la misma enfermedad y así, delante de Yaegashi, le sobrevino un ataque...",2003,OVA,4.0,31,Finalizado,220,4,"Drama,Terror,Vampiros,",https://www3.animeflv.net/anime/hitsuji-no-uta,https://www3.animeflv.net/uploads/animes/covers/405.jpg
Guardian Hearts,"La Guardian Heart con el nombre de Hina, accidentalmente revela a sí misma a un niño, que es Wataki. Los dos comienzan a vivir juntos. Dado que la historia progresa, más niñas que viven con ellos comienzan por la misma razón.",2003,OVA,4.5,28,Finalizado,406,6,"Comedia,Ecchi,Escolares,Magia,Romance,",https://www3.animeflv.net/anime/guardian-hearts,https://www3.animeflv.net/uploads/animes/covers/1476.jpg
Ultra Maniac,"Wataru Yoshizumi (mangaka conocida por sus mangas Marmalade Boy, Mint no Bokura, Kimishika no Iranai, ...) está de enhorabuena al ver adaptado al anime otro de sus mangas, en este caso, Ultramaniac.
Ayu es una estudiante de secundaria, guapa y buena en tenis. Su amiga Nina es una inexperta brujita que con un ordenador hace “magias” que a veces no surten el efecto deseado... Ayu está enamorada de Kaji, un guapo chico del instituto. Éste siempre está en compañía de su amigo Tsiuji. Estos cuatro adolescentes forman el elenco principal del shoujo en el que poco a poco se irán incorporando más personajes.
",2003,Anime,4.3,57,Finalizado,509,26,"Comedia,Escolares,Magia,Romance,Shoujo,",https://www3.animeflv.net/anime/ultra-maniac,https://www3.animeflv.net/uploads/animes/covers/1822.jpg
Lingerie Senshi Papillon Rose,"Tsubomi-chan, trabaja como modelo de lencería, es una manera como otra cualquiera de sobrevivir en el instituto. Poco se imagina que se convertirá involuntariamente en un arma en una batalla de proporciones orgásmicas; ya que una vez que se acuesta con el encantador Hikaru, sella su destino como un Soldado Papillon, y, usando su patentado movimiento ""Levantamiento Orgasmico de la Poderosa Erección"", Tsubomi-chan deberá luchar contra Regina Apis, una despiadada mujer que lo único que busca es hacerse con toda la energía sexual del planeta.
",2003,OVA,2.6,54,Finalizado,254,1,"Ciencia Ficción,Ecchi,Magia,Parodia,",https://www3.animeflv.net/anime/lingerie-senshi-papillon-rose,https://www3.animeflv.net/uploads/animes/covers/2026.jpg
RahXephon: Tagen Hensoukyoku,"ShitoHaruka, es una joven mujer de 29 años que perdió al amor de su vida en un instante. Intenta recordar ""algo"" muy importante para ella, y para ello se une a la institución TERRA. El objetivo de Haruka es Kamina Ayato. Es un estudiante 12 años más joven que ella. Sin embargo, Ayato era la persona por la que sentía algo cuando se fue con él a Junior High. Amantes separados en el tiempo, un entorno de ciencia ficción y la prueba de la verdad en los corazones de la gente. La película se anima con el RahXephon de Ayato y la batalla conta los Dolems. Si Ayato despierta completamente, el mundo experimentará una terrorífica situación. Para evitarlo, Haruka debe matar a Ayato. Será capaz Haruka de tomar esa decisión Y la ""bella durmiente"" espera el beso de Ayato. Cómo cambiará su amor",2003,Película,4.0,12,Finalizado,105,1,"Acción,Ciencia Ficción,Drama,Mecha,Psicológico,Romance,",https://www3.animeflv.net/anime/rahxephon-tagen-hensoukyoku,https://www3.animeflv.net/uploads/animes/covers/1457.jpg
Texhnolyze,"En una sociedad paralela del denominado bajo mundo, hay una lucha por el control de la ciudad de Lux. Ichise, un huérfano convertido en luchador callejero por dinero, pierde un brazo y una pierna para satisfacer a un enfurecido promotor de peleas. Ya cuando estaba a punto de morir, es recogido por una joven Doctora y utilizado como un conejillo de indias para la próxima evolución de los ""Texhnolyze"".
Con sus nuevas extremidades, Ichise se convierte en el protegido de Oonishi, un lider muy poderoso de la organización ""Organ"". Mientras Ichise es arrastrado profundamente en una guerra territorial sobre el control de la ciudad, este conoce a Ran una joven profeta que le habla sobre su posible futuro. Con la explosión de una gran guerra, Ichise debe revelar la verdadera historia detrás de Lux y pelear por su vida mientras se empieza a dar cuenta de cuál es su destino. ",2003,Anime,4.4,95,Finalizado,1120,22,"Acción,Ciencia Ficción,Drama,Psicológico,",https://www3.animeflv.net/anime/texhnolyze,https://www3.animeflv.net/uploads/animes/covers/2173.jpg
Tantei Gakuen Q,"El personaje principal,kyu renjou es un joven de 15 años que desea convertirse en detective y ser el mejor del mundo . Para esto ingresa a la prestigiosa academia de detectives Dan Morihiko o DDS donde conoce a otros jóvenes aspirantes a ser detectives junto a ellos resolverá misteriosos casos donde la perseverancia y amistad sera lo más importante.",2003,Anime,4.7,95,Finalizado,658,45,"Comedia,Drama,Misterio,Policía,Shounen,",https://www3.animeflv.net/anime/tantei-gakuen-q,https://www3.animeflv.net/uploads/animes/covers/1506.jpg
Kino no Tabi,"Los viajes de Kino: el Hermoso Mundo (???? -the Beautiful World-) es una serie de novelas ligeras, creadas por el escritor de novelas ligeras Keiichi Sigsawa, publicadas por primera vez en marzo del 2000,Trata de una joven inquieta que se dedica a recorrer el mundo acompañada por su medio de transporte: una moto llamada Hermes y con la habilidad de hablar. Viaja cuando y como quiere, pero siempre cumpliendo dos premisas muy importantes:
* No interferir en las peculiaridades de los lugares que visita
* Y no permanecer más de 3 días en cada país. ",2003,Anime,4.5,137,Finalizado,1672,13,"Acción,Aventuras,Recuentos de la vida,",https://www3.animeflv.net/anime/los-viajes-de-kino,https://www3.animeflv.net/uploads/animes/covers/693.jpg
