title,description,year,type,rate_start,votes,status,followers,episodes,genders,url_anime,image
Dragon Ball Z Especial: Freezer contra el padre de Goku,"Los Saiyajin han trabajado muy duro para Freezer. Sin embargo, éste temía que algún día los Saiyajin se le rebelaran, y apareciera el Legendario Super Saiyajin. Bardock se fue con sus compañeros a conquistar el planeta Kanassa, en el cual a Bardock le dieron un golpe, el cual le permitía tener visiones del futuro, entre ellas una futura destrucción del planeta de su especie, así como de la vida y obra de su hijo Son Goku.",1990,OVA,4.3,218,Finalizado,1249,1,,https://www3.animeflv.net/anime/dragon-ball-z-especial-1,https://www3.animeflv.net/uploads/animes/covers/1115.jpg
Dragon Ball Z Pelicula 03: La batalla más grande del mundo esta por comenzar,"Una banda de desértores del ejército de Freezer capitaneada por el misterioso Tarles llega a la tierra con una semilla terrible. Una vez plantada, surge un árbol monstruoso que amenaza con absorver toda vida en el planeta...",1990,Película,3.9,173,Finalizado,1090,1,"Aventuras,Ciencia Ficción,Comedia,Fantasía,Shounen,",https://www3.animeflv.net/anime/dragon-ball-z-pelicula-3,https://www3.animeflv.net/uploads/animes/covers/1104.jpg
Lodoss-tou Senki,"La historia se centra de alrededor de un joven llamado Parn, el hijo de un deshonroso caballero. Parte de esta motivación de aventurarse es encontrar que pasó con su padre, y restaurar el honor de su familia. A pesar de su inexperiencia, Parn es considerado el lider, quien esta acompañado por su mejor amigo un niño del bosque llamado Etoh, su amigo y a veces aconsejante Slayn (y más tarde en la amante de Slayn, Leylia), y su recién mentor Ghim. Son acompañados por el interés romántico de Parn, la alta elfa Deedlit, quien viene del Bosque sin Retorno buscando una solución para el aislacionismo de su gente y un final para la extinción. A lo largo de la serie, Parn entra en contacto con sus amigos y con sus enemigos por igual. Sus aliados incluyendo el rey Kashue, Fahn, Shiris y Orson; sus enemigos incluyendo el emperador Beld, Ashram y el malvado necrofago Wagnard.",1990,Anime,4.4,95,Finalizado,734,13,"Acción,Aventuras,Fantasía,Magia,Shounen,Sobrenatural,",https://www3.animeflv.net/anime/lodoss-tou-senki,https://www3.animeflv.net/uploads/animes/covers/1355.jpg
Fushigi no Umi no Nadia,"La revolución industrial ha terminado y el mundo está siendo consumido por una nueva tecnología y nuevas máquinas. Un joven científico, Jean, ve a una guapísima chica de color mientras se encuentra en Francia, la sigue y termina metiéndose en problemas. Mientras tanto, una mujer y sus dos matones están tras el amuleto de la chica, llamado Piedra Azul. La chica, Nadia, escapa con Jean. De esta forma, los dos intentarán evitar que los malvados se apoderen del amuleto.",1990,Anime,4.5,99,Finalizado,841,39,"Aventuras,Ciencia Ficción,Comedia,Historico,Romance,",https://www3.animeflv.net/anime/fushigi-no-umi-no-nadia,https://www3.animeflv.net/uploads/animes/covers/2190.jpg
Dragon Ball Z Pelicula 02: El hombre más fuerte de este mundo,"La situación empieza con el doctor Uir?, quien es revivido por el doctor Cochin (su compañero) con ayuda de las Dragon Balls, debido a que el primero se encontraba cautivo en el hielo de las montañas Tsumisumbri. Ya que desde hacia varios años su cerebro sobrevivía en un cuerpo robótico decidió robar el cuerpo al hombre más fuerte del mundo, pero debido a estar todos estos años encerrado en el hielo el seguía pensando que este era Kame Sen'nin. Gok? y sus amigos van al laboratorio de los doctores con el objetivo de salvar a Kame Sen'nin, y al llegar se tendrán que enfrentar contra los robots más poderosos creados por la mente ambiciosa de los científicos.",1990,Película,4.1,124,Finalizado,1070,1,"Aventuras,Ciencia Ficción,Comedia,Fantasía,Shounen,",https://www3.animeflv.net/anime/dragon-ball-z-pelicula-2,https://www3.animeflv.net/uploads/animes/covers/1103.jpg
Umezu Kazuo no Noroi,"Dos Historias separadas. En la primera titulada ""Qué revelara la camara de video"", una estudiante de intercambio llega de México causando gran agitación en la vida de una compañera de clase llamada Masami. En la segunda historia titulada ""La mansion embrujada"", cuatro niñas en una aventura en una siniestra casa.
",1990,OVA,4.2,38,Finalizado,136,1,"Terror,",https://www3.animeflv.net/anime/umezu-kazuo-no-noroi,https://www3.animeflv.net/uploads/animes/covers/2299.jpg
1+2=Paradise,,1990,OVA,4.0,165,Finalizado,852,2,"Comedia,Ecchi,Harem,Romance,Seinen,",https://www3.animeflv.net/anime/1-2-paradise,https://www3.animeflv.net/uploads/animes/covers/2162.jpg
Ninja Ryukenden,"En una oscura noche en New York City, Ryu es atacado por unos asesinos. Después de deshacerse de ellos, encuentra una tarjeta de identificación de la Friedman Company. Al día siguiente, se anuncia que el Dr. Ned Friedman ha descubierto una cura para el cáncer. Pero después de no proporcionar ninguna información en su rueda de prensa, Sarah, una reportera, decide investigar con la ayuda de sus amigos Roberto y Jeff. Al pasar por la casa del Dr. Friedman un día, Ryu oye la voz de una muchacha joven que pide ayuda. Descubren que el Dr. Friedman ha estado realizando experimentos en seres humanos vivos usando la biotecnología, y que puede tener algo hacer con la energía de los dioses demonios, que Ryu había derrotado en el pasado. Pero cuando secuestran a su amiga Irene, Ryu debe recuperar su papel como dragón Ninja para derrotar a este nuevo enemigo y para salvarla..",1991,OVA,4.3,20,Finalizado,86,1,"Aventuras,Ciencia Ficción,Demonios,Drama,Shounen,Sobrenatural,Suspenso,",https://www3.animeflv.net/anime/ninja-ryukenden,https://www3.animeflv.net/uploads/animes/covers/426.jpg
Otaku no Video,"Kubo es la tipica persona a la que le agradaba estudiar, practicar deportes y salir con chicas. Un dia, su amigo Tanaka le propone asistir a su casa para poder ver unos vídeos. Es tal la impresión de Kubo al poder ver sus series favoritas, además de del hobbys de los amigos de Takana, que con el tiempo Kubo empezo a faltar a sus citas deportivas y deja de salir con chicas. Pero lo peor de todo es que se convierte en un ser antisocial que trata de dominar al mundo mediante las series de anime para convertirse en el Otaking y construir Otakulandia.
",1991,OVA,4.5,33,Finalizado,161,2,"Ciencia Ficción,Comedia,Drama,Historico,Magia,Mecha,",https://www3.animeflv.net/anime/otaku-no-video,https://www3.animeflv.net/uploads/animes/covers/2021.jpg
Urusei Yatsura Movie 6: Itsudatte My Darling,,1991,Película,4.1,39,Finalizado,164,1,"Acción,Aventuras,Ciencia Ficción,Comedia,Drama,Romance,",https://www3.animeflv.net/anime/urusei-yatsura-movie-6-itsudatte-my-darling,https://www3.animeflv.net/uploads/animes/covers/2214.jpg
Silent Mobius: The Motion Picture,"La historia comienza en 2028. En un futuro próximo, un gran demonio se está infiltrando en el mundo de los humanos; una fuerza demoníaca conocida como Lucifer Hawk. En su camino se encuentra una pequeña organización de policías femeninas: la AMP de Tokyo. Dotadas de habilidades sobrenaturales, intentarán vencer a las fuerzas de la oscuridad allá donde aparezcan. Esta vez en un enorme rascacielos en constucción. Pero para un miembro de la AMP, Katsumi Liqueur, esta batalla en particular es personal.
",1991,Película,3.4,34,Finalizado,81,1,"Aventuras,Ciencia Ficción,Sobrenatural,",https://www3.animeflv.net/anime/silent-mobius-the-motion-picture,https://www3.animeflv.net/uploads/animes/covers/1926.jpg
Dragon Ball Z Pelicula 05: Los rivales mas poderosos,"Cuando Goku y sus amigos están en un día de campo, aparecen los soldados de Cooler a luchar contra éllos. el único que pudo con éllos fue Goku. Pero en ése momento llega Cooler y ataca a Gohan pero Goku hace lo posible por cuidarlo, y esto le pudo costar la vida.
Gohan fue encargado a buscar una semilla del ermitaño para que su padre se recuperara, y se va con la ayuda de su Dragon. Cuando Gohan llega al templo sagrado, Yajirobe le da una bolsa con las semillas, y le da una aparte, ya que el Maestro Karin no le quería dar hasta que no subiera la Torre de Karin desde el principio…",1991,Película,4.0,261,Finalizado,1256,1,"Aventuras,Ciencia Ficción,Comedia,Fantasía,Shounen,",https://www3.animeflv.net/anime/dragon-ball-z-pelicula-5,https://www3.animeflv.net/uploads/animes/covers/1106.jpg
Mobile Suit Gundam 0083: Stardust Memory,"Esta historia nos cuenta los acontecimientos ocurridos entre Mobile Suit Gundam y Mobile Suit Z Gundam. Es el año 0083 del Universal Century, han pasado 3 años desde el fin de la Guerra entre Zeon y la Federación, y aparentemente hay paz en la Tierra. Pero un grupo de soldados remanentes de Zeon al mando de Aiguille Delaz y su piloto As, Anavel Gato, atacan la Base Torrington en Australia para robar uno de los dos nuevos prototipos Gundam y llevar a cabo su terrible venganza contra la Federación Terrestre, conocida como la Operación Polvo Estelar. Kou Uraki, un joven cadete estacionado en la base Torrtington, toma a su cargo el Gundam Unidad 1 para detener a Gato, uniendo fuerzas con la tripulación de la nueva nave de la Federación: La Albion.",1991,OVA,4.4,47,Finalizado,163,13,"Aventuras,Ciencia Ficción,Drama,Espacial,Mecha,Militar,",https://www3.animeflv.net/anime/mobile-suit-gundam-0083-stardust-memory,https://www3.animeflv.net/uploads/animes/covers/1852.jpg
Burn Up!,"Los criminales están secuestrando a mujeres jóvenes que son usadas para la venta en el mercado de esclavas sexuales. Maki , Reimi y Yuka son tres policías de tráfico que deciden ir de incógnito a un club de baile donde presuntamente han ocurrido muchos de esos secuestros para así poder atrapar al jefe de la mafia que está detrás de todo. Pero las cosas van mal y Yuka termina siendo secuestrada.
",1991,OVA,3.8,20,Finalizado,147,1,"Acción,Ciencia Ficción,Comedia,Ecchi,Policía,",https://www3.animeflv.net/anime/burn-up,https://www3.animeflv.net/uploads/animes/covers/2170.jpg
Dragon Ball Z Pelicula 04: Goku es un Super Saiyajin,"Slug, un habitante del planeta Namek que reniega de su raza pacifista, llega a la tierra con intención de conquistarla y lo que para él es más importante, conseguir las esferas del dragón para desear la juventud eterna y así recuperar la fuerza que tenía antaño.",1991,Película,4.0,181,Finalizado,1097,1,"Aventuras,Ciencia Ficción,Fantasía,Shounen,",https://www3.animeflv.net/anime/dragon-ball-z-pelicula-4,https://www3.animeflv.net/uploads/animes/covers/1105.jpg
Mobile Suit Gundam F91,"Es el año 0123 del Universal Century, la Federación Terrestre comienza a debilitarse y grupos rebeldes aparecen en la Esfera Terrestre para hacerse con el poder. Crossbone Vanguard es un grupo aristocratico liderado por la familia Ronah, quienes buscan controlar las colonias espaciales, gracias a sus increíbles y sorpresivas tácticas de ataque.
Seabook Arno es un inquieto joven estudiante de ingeniería que vive en Frontier IV, una de las colonias espaciales de Side 1. Pero su pacífica vida se ve interrumpida con un ataque de Croosbone Vanguard a su colonia, donde muchos de sus amigos mueren. Pero las cosas no cambian solo para Seabook. Cecily Fairchild, una gran amiga de Seabook, descubre que es heredera de la familia Ronah, comenzando así un largo viaje para ambos jóvenes en busca de su destino.
Originalmente concebida como una serie de 26 capítulos, el proyecto fue rechazado por Sunrise, que exigía 50 episodios, por lo que Yoshiyuki Tomino, creador del Universo Gundam, decidio convertirla en una película.",1991,Película,3.4,61,Finalizado,103,1,"Ciencia Ficción,Drama,Espacial,Mecha,Militar,",https://www3.animeflv.net/anime/mobile-suit-gundam-f91,https://www3.animeflv.net/uploads/animes/covers/1864.jpg
Ginga Eiyuu Densetsu Gaiden: Ougon no Tsubasa,"Reinhard von Müsel, el hijo de un noble empobrecido, descubre un día que su hermana, Annerose, ha sido vendida a la familia real. Para recuperarla se propone escalar rápidamente en la milicia, junto con su amigo Siegfried Kircheis.
",1992,Película,4.2,43,Finalizado,180,1,"Acción,Ciencia Ficción,Drama,Espacial,Militar,Shounen,",https://www3.animeflv.net/anime/ginga-eyuu-densetsu-gaiden-ougon-no-tsubasa,https://www3.animeflv.net/uploads/animes/covers/2270.jpg
Yu Yu Hakusho: Ghost Files,"Yusuke Urameshi, un chico de catorce años un poco gamberro es atropellado por un coche cuando intentaba salvar la vida de un niño pequeño. Al ser atropellado, no sobrevive y muere. Entonces es cuando Botan le dice que su muerte no estaba prevista asi que no va ni al cielo ni al infierno, por lo cual se queda en la tierra como fantasma. Botan le dice de hacer una prueba para volver a la vida, la consigue superar y entonces es cuando le encomiendan la tarea de ser detective espiritual, con lo cual tendrá que resolver varios casos utilizando poderes espirituales que le dan.",1992,Anime,4.6,666,Finalizado,5988,112,"Acción,Artes Marciales,Comedia,Demonios,Escolares,Fantasía,Shounen,",https://www3.animeflv.net/anime/yu-yu-hakusho,https://www3.animeflv.net/uploads/animes/covers/351.jpg
Ushio to Tora,"Ushio es un joven que no cree ni una pizca de las historias de monstruos que le cuenta su papá, una de ellas dice que en el templo de su casa se halla un Youkai empalado desde hace 500 años …",1992,OVA,4.6,99,Finalizado,533,10,"Acción,Comedia,Terror,",https://www3.animeflv.net/anime/ushio-to-tora,https://www3.animeflv.net/uploads/animes/covers/2130.jpg
Mobile Suit Gundam 0083: The Fading Light of Zeon,"Película compilación de Stardust Memory.
U.C. 0083 - Tres años han pasado después de la ""Guerra de Un Año"", cuando un grupo de bandidos de Zeon conocidos como ""La Flota Delaz"" hace su movimiento robando el prototipo ""Gundam GP02A"". Esta aventura comienza cuando el piloto novato, Kou Uraki, toma control del Gundam GP01 para perseguir al as veterano de Zeon, Anavel Gato, con intención de recuperar el prototipo robado...",1992,Película,4.2,20,Finalizado,85,1,"Acción,Aventuras,Ciencia Ficción,Espacial,Mecha,",https://www3.animeflv.net/anime/mobile-suit-gundam-0083-the-fading-light-of-zeon,https://www3.animeflv.net/uploads/animes/covers/1853.jpg
Bastard,"15 años atrás un mago muy poderoso llamado Dark Schneider con ayuda de sus compañeros; Gara, Karls y Arshes-Nei, haciendose llamar ?los jinetes del Apocalipsis?, intentaron conquistar el mundo e instaurar una sociedad utópica, pero fueron derrotados y Dark Schneider fue sellado en el cuerpo de un niño por un sacerdote llamado Gio Noto Soto. Pasados estos 15 años los antiguos aliados de Dark Schneider se volvieron a reunir, esta vez unidos a un malvado hechicero llamado Abigail, los jinetes del Apocalipsis cabalgaban de nuevo, pero con un objetivo mucho mas oscuro que el anterior, resucitar a Anthrathax, la diosa de la total destrucción.",1992,OVA,4.3,70,Finalizado,369,6,"Acción,Aventuras,Comedia,Ecchi,Fantasía,Seinen,",https://www3.animeflv.net/anime/bastard,https://www3.animeflv.net/uploads/animes/covers/433.jpg
Silent Mobius 2,"Después de los acontecimientos de la parte de flashback de Silent Mobius: The Motion Picture 1 sólo una cosa tiene Katsumi Liqueur en su mente ""dejar esta terrible ciudad cuanto antes, este lugar donde ella no conoce a nadie y no tiene ningún amigo"". Pero ella pronto afronta serios obstáculos a esa intención, como que la ""Attacked Mystification Police"" insiste en reclutar a Katsumi para su organización.
Vagando sin rumbo por las calles de Tokio, cruza su camino con otra joven mujer cuyo destino parece estar entrelazado con el suyo. El pasado misterioso de ambas muchachas parece estar vinculado con el puente de la bahía de Tokyo ... un puente que Katsumi ha visto en sus sueños...
Esta secuela de Silent Mobius: The Motion Picture 1 sigue la linea argumental de la parte del flashback de la primera película (contacto inicial de Katsumi con la AMP), usando un poco más ideas y personajes del manga, y es ligeramente menos incompatible a la serie Silent Mobius TV de 1998.",1992,Película,3.3,20,Finalizado,55,2,"Aventuras,Ciencia Ficción,Demonios,Fantasía,Seinen,",https://www3.animeflv.net/anime/silent-mobius-2,https://www3.animeflv.net/uploads/animes/covers/1927.jpg
Kurenai no Buta,"Romántica historia sobre un piloto de hidroavión, italiano, as de la Primera Guerra Mundial, que vive como cazarecompensas independiente contra otros mercenarios ""Piratas del Aire"" en el Mar Adriático. Víctima de una maldición indeterminada que ha convertido sus facciones en las de un cerdo. Es un descreído solitario que subsiste al margen de ideologías y de la gente. Un lobo solitario, que mantiene una vieja amiga secretamente enamorada de él, se ve inmerso en un un duelo con un piloto norteamericano fanfarrón que despierta parte de su vieja gloria y le hace redescubrir parte de sus sentimientos. ",1992,Película,4.5,147,Finalizado,777,1,"Acción,Aventuras,Comedia,Drama,Historico,Militar,Romance,",https://www3.animeflv.net/anime/kurenai-no-buta,https://www3.animeflv.net/uploads/animes/covers/1671.jpg
Dragon Ball Z Pelicula 07: La pelea de los tres Saiyajin,"Cuando el Dr. Maki Gero murió asesinado por #17, el ordenador central no quedo desactivado, sino siguió trabajando. Este trabajo consistió en crear tres nuevos androides: #13, #14 y #15; con el único motivo de destruir a Goku.
El #13 fue el último en activarse, mientras, sus dos compañeros estaban localizando a Goku. Localizado, #13 va en su busca, que estaba en las tierras de hielo. Allí se presentó a Goku, quien es su único objetivo, aunque se interpuso Piccoro.
Combatió de igual a igual, pero la balanza se desquilibró, cuando Goku, alcanza el nivel de Super Saiyajin, junto con Vegeta y Trunks, que estaban combatiendo a los otros dos androides. Vegeta y Trunks aniquilan a sus dos adversarios, y #13 queda malherido…",1992,Película,4.2,217,Finalizado,1204,1,"Aventuras,Ciencia Ficción,Comedia,Fantasía,Shounen,",https://www3.animeflv.net/anime/dragon-ball-z-pelicula-7,https://www3.animeflv.net/uploads/animes/covers/1108.jpg
Choujikuu Yousai Macross II: Lovers Again,"La historia de ""Chojiku yosai Macross II - Lovers Again"" se remonta 80 años después de los acontecimientos sucedidos en Macross. Ahora la tierra vive en paz donde los Zentraedis y los humanos coexisten pacíficamente. La historia se centrará en el joven reportero de la cadena televisiva SNN, Hibiki Kanzaki, cuya vida cambiara completamente cuando una nueva fuerza alienígena entra a nuestro sistema solar y este es designado a cubrir la noticia donde las Fuerzas armadas Terrícolas son enviadas a detener a los invasores. Durante la batalla, Hibiki conoce a una bella extraterrestre llamada Ishtar y aquí es donde comienza toda la historia.",1992,OVA,4.2,31,Finalizado,127,6,"Aventuras,Ciencia Ficción,Espacial,Mecha,Militar,Shounen,",https://www3.animeflv.net/anime/choujikuu-yousai-macross-2-lovers-again,https://www3.animeflv.net/uploads/animes/covers/1583.jpg
Dragon Ball Z Pelicula 06: El regreso de Cooler,"El nuevo kamisama, Dende, se entera que su planeta natal, Namek, está en peligro. Pide ayuda a Goku y sus amigos para que salven su planeta así que los guerreros Z deciden ir a ayudar. Al llegar Goku y sus amigos (Piccoro, Gohan, Krilin, Ulong, Maestro Roshi y Yajirobe) se dan cuenta que una especie de estrella esta atacando al planeta.
Los namekianos estaban siendo apresados por unos robots y deciden ayudarlos pero se dan cuenta que los robots son muy fuertes y son capturados para que su energía sea absorbida por la gran estrella. Detrás de todo esto esta Cooler, el hermano mayor de Freezer, al que pensaban que Goku, había vencido. Esta vez es de metal y su cerebro forma parte de un ordenador, con el que puede clonarse en miles de Metal Cooler’s…",1992,Película,4.2,166,Finalizado,1165,1,"Aventuras,Ciencia Ficción,Comedia,Fantasía,Shounen,",https://www3.animeflv.net/anime/dragon-ball-z-pelicula-6,https://www3.animeflv.net/uploads/animes/covers/1107.jpg
Sailor Moon,"Serena Tsukino es una chica común, tiene 14 anos y asiste a segundo de secundaria. Siempre llega tarde a clase, olvida los deberes, duerme mucho y come demasiado; pero su vida cambia cuando una gata negra muy peculiar se presenta ante ella para desvelarle su misión: ella es una guerrera de la Luna, Sailor Moon, destinada a luchar por el amor y la justicia. Y no es la única, pronto aparecerían otras chicas, Sailor Scouts, con quienes entablara una amistad de toda la vida. Al lado de ellas y de Tuxedo Mask (su salvador emergente) deberán vencer a la Reina Beril del Negaverso y descubrir importantes señales de un pasado milenario.",1992,Anime,4.6,1336,Finalizado,13292,200,"Demonios,Magia,Romance,Shoujo,",https://www3.animeflv.net/anime/sailor-moon,https://www3.animeflv.net/uploads/animes/covers/180.jpg
Uchuu no Kishi Tekkaman Blade,"Tekkaman Blade transcurre en el año 2300 D.C. La tierra ha sido invadida por unas extrañas plantas venenosas que han diezmado la población humana hasta el punto de casi extinguirla. Un día cae del espacio un meteorito y del cráter que provoca sale un chico con amnesia que llama a los alienígenas ""Radam"". Momentos después los Radam comienzan a invadir la Tierra. ¿Por qué el chico conoce a los alienígenas y de dónde ha obtenido los poderes con los que los combate?",1992,Anime,4.4,54,Finalizado,330,49,"Acción,Aventuras,Ciencia Ficción,Drama,Espacial,Mecha,Militar,Romance,Shounen,",https://www3.animeflv.net/anime/uchuu-no-kishi-tekkaman-blade,https://www3.animeflv.net/uploads/animes/covers/1948.jpg
Ginga Eiyuu Densetsu: Arata Naru Tatakai no Overture,"Basada en una serie de novelas de ciencia-ficción, esta serie narra la historia de un conflicto entre el Imperio Galáctico (parecido a Prusia) y la Alianza de Planetas Libres. Describe todos los niveles de la guerra, desde tácticas hasta estrategias, pero se centra en los dos líderes militares de ambos bandos- Reinhard Von Lohengram y Yang Wen-Li.
",1993,Película,4.3,41,Finalizado,115,1,"Acción,Ciencia Ficción,Drama,Espacial,Militar,",https://www3.animeflv.net/anime/ginga-eiyuu-densetsu-arata-naru-tatakai-no-overture,https://www3.animeflv.net/uploads/animes/covers/2272.jpg
JoJo's Bizarre Adventure,"Josef y Jotaro han reunido varios guerreros místicos cada uno con poderes, representando las cartas de Stand (Una variación de las cartas del Tarot), con Jotaro teniendo poderes sobre el más poderoso Stand (el Star Platinum). El propio Dio ha reunido guerreros Stand y juntos a ellos luchará por el destino de la madre de Jotaro (Holly) y la dominación del mundo.",1993,OVA,4.3,347,Finalizado,2517,13,"Aventuras,Drama,Fantasía,Shounen,Sobrenatural,Terror,Vampiros,",https://www3.animeflv.net/anime/jojos-bizarre-adventure,https://www3.animeflv.net/uploads/animes/covers/1008.jpg
Slam Dunk,"Un estudiante de preparatoria llamado Hanamichi Sakuragi, que sufre una serie de rechazos amorosos hasta que un buen día conoce a una chica a quien le fascina el baloncesto. A causa de esto Hanamichi fingirá ser un deportista y se inscribirá en el club de baloncesto del colegio con la esperanza de poder impresionarla y salir con ella. Aunque con el tiempo descubrirá en el baloncesto un deporte que lo exigirá y pondrá a prueba sacando lo mejor de él. ",1993,Anime,4.6,1022,Finalizado,5915,101,"Comedia,Deportes,Drama,Escolares,Shounen,",https://www3.animeflv.net/anime/slam-dunk,https://www3.animeflv.net/uploads/animes/covers/335.jpg
Dragon Ball Z Pelicula 09: La Galaxia corre peligro,"Un misterioso torneo de las artes marciales llama la atencion de los guerreros z, al cual deciden entrar. Krillin, Trunks y Gohan pasan a las semifimales, en donde tendrian que enfrentarse contra los dicipulos de Satan, pero algo extraño sucede. Al comenzar cada batalla, los guerreros z se daran cuenta de que los cuatro peleadores rivales no son peleadores normales de este planeta y que son extremadamente fuertes. Asi Vegeta y Piccolo llegaran para ayudar, pero queda en duda si podran ganar esta vez, cuando conozcan el verdadero poder de uno de los enemigos, Boujack",1993,Película,4.3,189,Finalizado,1132,1,"Aventuras,Ciencia Ficción,Comedia,Fantasía,Shounen,",https://www3.animeflv.net/anime/dragon-ball-z-pelicula-9,https://www3.animeflv.net/uploads/animes/covers/1110.jpg
Ninja Scroll,"Resumen de Complot: Catorce años después de derrotar al guerrero inmortal Himuro Genma y frustrar el Shogun de los malos proyectos de Dark, Kibagami el Jubei sigue vagando por todas partes de Japón como un esgrimidor masterless. Durante su viaje, él encuentra Shigure, una sacerdotisa que nunca ha visto el exterior mundial su pueblo. Pero cuando un grupo de demonios destruye el pueblo y mata a cada uno, Jubei se hace un objetivo principal después de adquirir la Joya de Dragón - una piedra con un origen desconocido. Mientras tanto, Shigure - junto con el monje Dakuan y un ladrón joven llamó Tsubute - viajes al pueblo de Yagyu. Y con dos clanes de demonio que ahora persiguen Shigure, Dakuan debe adquirir otra vez los servicios de Jubei para proteger a la Sacerdotisa de la Luz.",1993,Anime,4.5,129,Finalizado,1098,13,"Aventuras,Fantasía,Historico,Romance,Shounen,Sobrenatural,Terror,",https://www3.animeflv.net/anime/ninja-scroll,https://www3.animeflv.net/uploads/animes/covers/560.jpg
